{
  "report_id": "ind-radar-2026-08-17",
  "date": "2026-08-17",
  "radar_type": "industrial",
  "market_segment": "industrial",
  "experiment_week": 1,
  "version": "v1.0",
  "scanner_summary": {
    "total_scanned": 52,
    "total_signals": 15,
    "engine_a_count": 5,
    "engine_b_count": 10,
    "p1_count": 0,
    "p2_count": 7,
    "p3_count": 8,
    "signal_count": 3,
    "potential_count": 12,
    "ims_opportunity_count": 0,
    "industry_breakdown": {
      "battery": 5,
      "pharma": 4,
      "food_beverage": 1,
      "semiconductor": 1,
      "petrochemical": 1,
      "cross_industry": 3
    },
    "engine_breakdown": {
      "A_compliance": 5,
      "B_project_capex": 10
    },
    "timing_breakdown": {
      "Early Trigger": 2,
      "Planning/Feasibility": 4,
      "Design": 4,
      "EPC/Project Prep": 2,
      "Tender/Procurement": 1,
      "Execution": 1,
      "Completed/Too Late": 0
    }
  },
  "top_5_match": [
    {
      "rank": 1,
      "id": "IND-20260814-001",
      "name": "生态环境法典施行+排污许可重点管理制度统一 — 全国名录更新",
      "engine": "A",
      "industry": "cross_industry",
      "priority": "P2",
      "match_priority": "B",
      "match_reason": "法典8/15正式施行，第184条将自动监测设备安装+联网+运维写入法定义务。'重点排污单位'统一并入'排污许可重点管理'。国务院令843号修改12部行政法规。16种自动监测违法情形明确。绵阳等多地名录持续发布。9-11月为6个月合规建设窗口期。",
      "agent_checklist": [
        "对比2025 vs 2026名录，识别5大重点行业中的新增水环境重点排污单位",
        "交叉匹配新增企业是否为Hach客户（SFDC Account）",
        "确认新增企业的Hach装机情况及是否已有在线监测仪表",
        "评估法典第184条法定自动监测义务对IMS合规引擎场景的推动",
        "关注'排污许可重点管理'统一后与旧'重点排污单位'名录的映射关系"
      ]
    },
    {
      "rank": 2,
      "id": "IND-20260817-003",
      "name": "浙江工业园区污水零直排+'自动关阀'在线监测机制",
      "engine": "A",
      "industry": "cross_industry",
      "priority": "P2",
      "match_priority": "B",
      "match_reason": "浙江推动4万+工业企业'一企一策'，安吉县临港工业园实现废水出厂在线监测+数据达标才能进入管网+不达标自动关阀。瓯江口园区在22个点位布设在线监测设备。这是工业市场'污水零直排'驱动在线仪表+数据管理的强信号。",
      "agent_checklist": [
        "确认浙江工业园区（安吉/瓯江口等）是否为Hach客户",
        "评估'自动关阀'在线监测场景的IMS适用性（分户计量+合规记录）",
        "追踪浙江'污水零直排'模式的全国推广情况",
        "确认园区内化工/电池/制药企业的Hach装机情况"
      ]
    },
    {
      "rank": 3,
      "id": "IND-20260814-004",
      "name": "卫蓝海博(淄博)4GWh固态锂电池项目",
      "engine": "B",
      "industry": "battery",
      "priority": "P2",
      "match_priority": "B",
      "match_reason": "环评已批复，配套水处理站，废水执行GB 30484-2013。4.2亿投资新建固态电池产线。环评阶段信息明确含水系统建设需求。No new fact today — no material change.",
      "agent_checklist": [
        "确认卫蓝海博(淄博)是否为Hach客户",
        "确认项目水处理站设计方/EPC方",
        "评估电池行业废水监测的Hach仪表适用性（氟/锂/重金属）",
        "追踪项目从环评批复进入设计/采购阶段的时间节点"
      ]
    },
    {
      "rank": 4,
      "id": "IND-20260814-005",
      "name": "云南裕能新能源电池材料二期扩建",
      "engine": "B",
      "industry": "battery",
      "priority": "P2",
      "match_priority": "B",
      "match_reason": "7.5亿投资，新增16万吨磷酸铁生产线。环评公示中，环保投资2710万含废水设施。大型企业自建水系统。No new fact today.",
      "agent_checklist": [
        "确认云南裕能是否为Hach客户（湖南裕能子公司）",
        "确认一期项目水处理设施及Hach仪表装机情况",
        "评估二期扩建的增量仪表需求"
      ]
    },
    {
      "rank": 5,
      "id": "IND-20260814-010",
      "name": "长兴煤山污水处理厂（服务电池产业园区）",
      "engine": "B",
      "industry": "battery",
      "priority": "P2",
      "match_priority": "B",
      "match_reason": "新建1.5万t/d工业污水处理厂，服务国家级绿色制造产业园。尾水氟离子执行GB 30484-2013。园区集中处理模式（B类），是IMS潜在入口。No new fact today.",
      "agent_checklist": [
        "确认长兴清泉排水有限公司是否为Hach客户",
        "确认园区内电池企业及Hach装机情况",
        "评估园区污水厂分户计量/数据管理需求的IMS适用性"
      ]
    }
  ],
  "market_background": [
    {
      "id": "IND-20260814-000",
      "title": "《中华人民共和国生态环境法典》2026-08-15正式施行 — 排污许可制度7大变化",
      "description": "法典5编1242条正式施行。排污许可管理专章（第174-186条）核心变化：①'重点排污单位'统一并入'排污许可重点管理'，两套名目合为一证；②第184条将自动监测设备安装+联网+运维写入法定义务（非政策倡导）；③第183条所有持证企业须自行监测，台账保存≥5年；④第185条信息公开法定化；⑤16种自动监测违法情形明确，罚款上限近100万；⑥双罚制常态化（企业+个人）；⑦全流程监管（从废水产生到排放末端）。国务院令843号同步修改12部行政法规、废止3部。多地方法规（中山/无锡/江苏等）同步修订。",
      "ims_relevance": "法典将自动监测从政策层面提升至法定义务层面。重点管理单位的自动监测设备安装+联网+数据管理需求将成为法律硬性要求。IMS合规引擎场景（合规记录自动化/数据管理/远程监控）在工业市场的政策驱动力显著增强。但需转化为具体公司级机会。",
      "priority": "P2",
      "source_urls": [
        "https://mp.weixin.qq.com/s?__biz=MzAwNTAyMzczMw==&mid=2654551477&idx=1&sn=78e479adbe01163cf270e6701f236865",
        "https://zhuanlan.zhihu.com/p/2071619876725207130",
        "https://mp.weixin.qq.com/s?__biz=MzA5MTU4NzgyMA==&mid=2649987289&idx=1&sn=a2bc0f3461462ed7bcb015234570198b",
        "https://www.sohu.com/a/1063263764_121123737",
        "https://baijiahao.baidu.com/s?id=1873570445709411342"
      ]
    },
    {
      "id": "IND-20260817-000",
      "title": "生态环境部通知加强工业污水污染风险防范 保障农业灌溉用水安全",
      "description": "生态环境部2026年8月5日发布通知，要求排查农田周边工业企业及园区污水排放，2026年底前完成整治方案。禁止向农田灌溉渠道排放工业废水。指导开展地方水污染物排放标准制修订，特征污染物依法载入排污许可证。工业园区污水集中处理设施建设改造加速。",
      "ims_relevance": "工业废水排放管控进一步收紧，特征污染物监测要求扩大。对工业园区污水集中处理设施的在线监测需求有推动作用。间接利好工业市场仪表+数据管理需求。",
      "priority": "P3",
      "source_urls": [
        "https://www.mee.gov.cn/xxgk2018/xxgk/xxgk05/202608/t20260805_1163609.html"
      ]
    }
  ],
  "signals": [
    {
      "id": "IND-20260814-001",
      "market_segment": "industrial",
      "company": "多地工业企业（武汉525家/晋江419家/浦东271家/北京326家/宁夏686家/绵阳等）",
      "industry": "cross_industry",
      "location": "全国多地",
      "opportunity": "2026年环境监管重点单位名录大规模更新+生态环境法典8/15正式施行，法定自动监测义务落地",
      "signal_tier": "Tier 1",
      "engine": "A",
      "evidence": {
        "facts": [
          "法典第184条：排污许可重点管理单位须安装/使用/维护自动监测设备+联网+保存原始记录（法定义务，非政策倡导）",
          "法典统一'重点排污单位'为'排污许可重点管理'，两套名目合为一证",
          "16种自动监测违法情形明确，恶意违法罚款上限近100万，双罚制常态化",
          "国务院令843号同步修改12部行政法规（含生态环境监测条例）、废止3部",
          "绵阳市2026名录政策解读确认'纳入重点监管的企事业单位应安装自动监测设备并联网'",
          "浦东新区明确6个月自动监控建设窗口，9-11月为合规建设期",
          "中山/无锡/江苏等地方法规同步修订以对齐法典"
        ],
        "inferences": [
          "法典施行后，自动监测从政策驱动升级为法律驱动，工业企业合规建设紧迫性增强",
          "'重点排污单位'统一为'排污许可重点管理'后，监管对象范围可能扩大"
        ],
        "unknowns": [
          "无法从公开信息确定哪些企业是'新增'（vs 沿用2025年），需对比去年名录",
          "法典第184条'自动监测设备'是否包含数据管理系统/远程监控的具体技术要求尚不明确",
          "具体企业的仪表采购需求和时间线"
        ]
      },
      "potential_ims_use_case": "法定自动监测义务→仪表安装+数据联网→合规记录自动化/数据管理/远程监控（IMS合规引擎场景）",
      "logic_rationale": "法典施行 → 第184条法定自动监测义务 → 重点管理单位须安装+联网+保存记录 → 仪表采购+数据管理需求 → IMS潜在机会",
      "opportunity_stage": "Design",
      "estimated_time_window": "2026年9-11月（6个月合规窗口）+ 法典施行后持续推动",
      "priority": "P2",
      "water_system_ownership": "N/A",
      "incrementality_status": "unknown",
      "to_verify": {
        "customer_identity": "对比2025 vs 2026名录，识别5大重点行业新增水环境重点排污单位；交叉匹配SFDC Account",
        "installed_base": "新增企业的Hach仪表装机情况及是否已有在线监测仪表",
        "commercial_history": "历史销售/Opportunity/Win-Loss？当前Pipeline？",
        "ims": "法典第184条法定自动监测义务对IMS合规引擎场景的推动评估",
        "account_sales": "受影响企业的Account Owner？"
      },
      "source_urls": [
        "https://mp.weixin.qq.com/s?__biz=MzAwNTAyMzczMw==&mid=2654551477&idx=1&sn=78e479adbe01163cf270e6701f236865",
        "https://zhuanlan.zhihu.com/p/2071619876725207130",
        "https://mp.weixin.qq.com/s?__biz=MzA5MTU4NzgyMA==&mid=2649987289&idx=1&sn=a2bc0f3461462ed7bcb015234570198b",
        "https://sthjj.my.gov.cn/myssthjj/c105844/202604/0825c33651074f8f8267f5f3aa3d30b9.shtml",
        "https://www.sohu.com/a/1063263764_121123737",
        "https://www.jinjiang.gov.cn/xxgk/zdxxgk/hjbh/zdwryxx/202605/t20260511_3290677.htm",
        "https://sthj.sh.gov.cn/cmsres/1e/1e042ba8f2254f449a91904fa9ca4a44/4f642cc1a548ae5244f449a91904fa9ca4a44.pdf"
      ],
      "continuity": {
        "first_seen": "2026-08-14",
        "new_facts_today": [
          "法典8/15正式施行，第184条自动监测成为法定义务",
          "'重点排污单位'统一并入'排污许可重点管理'",
          "16种自动监测违法情形明确，双罚制常态化",
          "国务院令843号修改12部行政法规",
          "绵阳市2026名录政策解读确认自动监测义务",
          "中山/无锡/江苏等地方法规同步修订"
        ],
        "changed": true
      }
    },
    {
      "id": "IND-20260814-002",
      "market_segment": "industrial",
      "company": "华润双鹤药业股份有限公司沧州分公司",
      "industry": "pharma",
      "location": "河北沧州",
      "opportunity": "2026年7月发布排污许可证自行监测服务采购公告（2026.8-2027.7年度）",
      "signal_tier": "Tier 2",
      "engine": "A",
      "evidence": {
        "facts": [
          "采购范围包括废水/废气/无组织/噪声检测+VOC进口监测+在线设备比对监测",
          "采购公告编号SHXYGG202607110002",
          "依据HJ 883-2017"
        ],
        "inferences": [
          "已有在线设备但需比对监测，说明已安装自动监测设备"
        ],
        "unknowns": [
          "具体在线仪表品牌和数量",
          "是否已有数据管理系统"
        ]
      },
      "potential_ims_use_case": "已有在线仪表→比对监测服务需求→可能存在数据管理/维护需求",
      "logic_rationale": "自行监测义务 → 已有在线设备需比对 → 仪表数据管理/维护需求 → IMS潜在机会（间接）",
      "opportunity_stage": "Tender/Procurement",
      "estimated_time_window": "已进入采购阶段，领先性弱",
      "priority": "P3",
      "water_system_ownership": "N/A",
      "incrementality_status": "unknown",
      "to_verify": {
        "customer_identity": "华润双鹤药业沧州分公司是否为Hach客户？",
        "installed_base": "现有在线仪表品牌/型号/数量？是否有Hach仪表？",
        "commercial_history": "历史销售/服务合同？",
        "ims": "是否已有数据管理系统？",
        "account_sales": "Account Owner？"
      },
      "source_urls": [
        "https://www.dowater.com/zhaobiao/2026-07-13/12398946.asp"
      ],
      "continuity": {
        "first_seen": "2026-08-14",
        "new_facts_today": [],
        "changed": false
      }
    },
    {
      "id": "IND-20260814-003",
      "market_segment": "industrial",
      "company": "中药类制药工业企业（全国）",
      "industry": "pharma",
      "location": "全国",
      "opportunity": "2026年5月生态环境部发布《中药类制药工业水污染物排放标准》征求意见稿",
      "signal_tier": "Tier 2",
      "engine": "A",
      "evidence": {
        "facts": [
          "标准修订中，收紧排放限值",
          "征求意见稿阶段"
        ],
        "inferences": [
          "标准正式发布后，中药制药企业可能需要升级监测能力"
        ],
        "unknowns": [
          "标准正式发布时间",
          "具体收紧了哪些限值",
          "是否新增在线监测要求"
        ]
      },
      "potential_ims_use_case": "排放标准收紧 → 监测能力升级 → 在线仪表需求 → IMS潜在机会",
      "logic_rationale": "排放标准修订 → 收紧限值 → 企业需升级监测 → 在线仪表需求 → IMS潜在机会（尚早）",
      "opportunity_stage": "Early Trigger",